<?xml version="1.0" encoding="UTF-8" standalone="yes"?>
<SimkitAssembly package="diskit" version="1.0" name="DISServer3DTestAssembly" xsi:noNamespaceSchemaLocation="http://diana.gl.nps.navy.mil/Simkit/assembly.xsd" xmlns:xsi="http://www.w3.org/2001/XMLSchema-instance">
    <SimEntity name="SimServer3DTest_0" type="diskit.SimServer3DTest">
        <TerminalParameter type="java.lang.String" value="239.0.0.5"/>
        <TerminalParameter type="int" value="1500"/>
        <TerminalParameter type="double" value=".001"/>
        <Coordinate y="189" x="285"/>
    </SimEntity>
    <SimEntity name="SimPinger_1" type="diskit.SimPinger">
        <TerminalParameter type="double" value="1.0"/>
        <TerminalParameter type="long" value="1000"/>
        <Coordinate y="81" x="133"/>
    </SimEntity>
    <PropertyChangeListener name="SimplePropertyDumper_1" type="simkit.util.SimplePropertyDumper">
        <Coordinate y="300" x="100"/>
    </PropertyChangeListener>
    <PropertyChangeListenerConnection property="" listener="SimplePropertyDumper_1" source="SimServer3DTest_0"/>
    <Output entity="SimServer3DTest_0"/>
    <Output entity="SimPinger_1"/>
    <Schedule verbose="false" stopTime="100."/>
</SimkitAssembly>

