<?xml version="1.0" encoding="UTF-8" standalone="yes"?>
<SimkitAssembly name="IndianIsland" package="atfp" version="1.0" xsi:noNamespaceSchemaLocation="http://diana.gl.nps.navy.mil/Simkit/assembly.xsd" xmlns:xsi="http://www.w3.org/2001/XMLSchema-instance">
    <SimEntity description="" name="ScenarioManager" type="diskit.ScenarioManager">
        <TerminalParameter name="p[0] : " type="boolean" value="true"/>
        <TerminalParameter name="p[1] : " type="java.lang.String" value="239.255.5.8"/>
        <TerminalParameter name="p[2] : " type="int" value="62040"/>
        <TerminalParameter name="p[3] : " type="int" value="0"/>
        <TerminalParameter name="p[4] : " type="int" value="1"/>
        <Coordinate x="220" y="130"/>
    </SimEntity>
    <SimEntity description="Overall Area of ammo pier, includes the three access piers" name="AmmoPier" type="diskit.Pier">
        <MultiParameter type="diskit.Vec3d">
            <TerminalParameter name="p[0] : " type="double" value="-343.347"/>
            <TerminalParameter name="p[1] : " type="double" value="-1178.404"/>
            <TerminalParameter name="p[2] : " type="double" value="-47.074"/>
        </MultiParameter>
        <TerminalParameter name="length" type="double" value="360"/>
        <TerminalParameter name="width" type="double" value="20"/>
        <TerminalParameter name="height" type="double" value="3"/>
        <TerminalParameter name="rotation" type="double" value="-16.5"/>
        <Coordinate x="220" y="230"/>
    </SimEntity>
    <SimEntity description="" name="DISPinger" type="diskit.DISPinger">
        <TerminalParameter name="p[0] : " type="double" value=".2"/>
        <TerminalParameter name="p[1] : " type="long" value="200"/>
        <Coordinate x="220" y="20"/>
    </SimEntity>
    <SimEventListenerConnection listener="ScenarioManager" source="DISPinger"/>
    <Schedule stopTime="1000" verbose="false"/>
    <Experiment timeout="5000" totalSamples="1"/>
</SimkitAssembly>

